{
  "schema": "ucc.large-data-reference",
  "schema_version": 1,
  "id": "img_01K0A6R4V8W6E3M4M8Y0R9J2Q1",
  "created_at": "2026-08-22T12:00:00.000Z",
  "created_by": "act_01K0A6R4V8W6E3M4M8Y0R9J2QA",
  "record_version": 1,
  "store_id": "vmf-images",
  "object_kind": "vm-images",
  "object_id": "ubuntu-24.04-base.qcow2",
  "relative_path": "vm-images/ubuntu-24.04-base.qcow2",
  "size_bytes": 2147483648,
  "sha256": "sha256:0123456789abcdef0123456789abcdef0123456789abcdef0123456789abcdef",
  "availability": "online"
}
